Name,Address,Telephone
S&S Logistic Pvt. LTD.,"Uttar Dhoka, Kholagal Marga, Kathmandu, Nepal,","+977 1 4424668+977 1 4416965,+977 9851067192,"
Upaya: City Cargo,"Babarmahal,","+977 988-1098830,,"
Kantipur Logistics Pvt. Ltd.,"kathmandu,","01-4493142,,"
Atlas De Cargo Pvt. Ltd.,"Tangal, Thirbam Sadak,","+977-1-4445666,,"
Total Logistic Service Pvt Ltd,"Nakhudobato, Lalitpur ,","015548090,,"
United Shipping & Forwarding Service P. Ltd,"Basanta Marg, House no. 351, 2nd floor, Babarmahal, Kathmandu,Nepal,","977 1 4221222/4246543,,"
Upaya: City Cargo,"Bluestar Complex, Thapathali,","9881098830,9881098830,"
Moonlight Freight Private Limited,"Narshing Chowk, Thamel, Kathmandu, Nepal,","4262350,98510114269841423073,"
