Name,Address,Telephone
Sutra Construction & Designers(Prefab)P.ltd,"Tinkune Gairigaon,Gauri Marg; Kathmandu Nepal,","01-6924123,9851188409985124840998498254099748936524,"
Green Design Nepal Pvt. Ltd.,"1st Floor, Shankamul Tower, Shankamul,","9851120343,9851120343,"
Vara Architects and Builders (Pvt) Ltd.,"Baneshower , Kathmandu,","9851000641,9816900341,"
J&J ENTERPRISES,INDIA,"+91-151-2520362,+91-9414137362,"
We Care Engineering Consultancy Pvt.Ltd,"Bharatpur-15,Mangalpur Bazzar,Chitwan ,Nepal,","056695173,,"
Quest Interiors (P) Ltd.,"Guheshwori Town Planning, Siddartha Chowk,","00977-01-5155201,00977-9851040767,"
Royal Engineers and Associates,"Lahan-7,Siraha, Nepal,","+97733560851,+9779862923252,"
Sustainable Building Design Nepal,"Kalimati, Kathmandu, Nepal,","+977-9841403407,+977-9841403407,"
The Unity Eco Village,"Lauruk Kaski 4,","9805865724,9861686866,"
Green Design Nepal Pvt. Ltd.,"Sankhamul,","9851120343,9851120343,"
