Name,Address,Telephone
Petrogreen Petroleum,"Andheri Kurla Road, Andheri west Mumbai,","09315460835,09315460835,"
Nepal Gas Industries,"Balaju,","+977-1-4350416,,"
Aditya Enterprises Pvt Ltd,"Kathmandu, Behind Honda Showroom,below Laxmi Bank,teku Road,","+977-1-4100066,,"
Sahara Gas Industry Pvt. Ltd.,"E - W Hwy,","+977-57-411010,,"
kushum enterprises pvt ltd,"Milan chowk,sitapaila,Ring Road,","9801098144,,"
BAGMATI COMMERCIAL PVT LTD,"Bhansar Marg, Teku-12,","01-4239429,9851126112,"
Samundra Engineering & Heavy Equipment Pvt. Ltd.,"Thamel, P.O. Box: 11943, Ktm,","00977-1-4266445,00977-9851026693,"
NARAYANI OIL AND REFINARY UDYOG.PVT. LTD.,"Main Road,","521864529892,,"
Unicorn Lubricants Pvt Ltd,"Ward No 19,","+977 52 532032,+977 9804240070,"
ADARSH OIL INDUSTRIES,"Main Road,","521864529892,,"
Bagmati Gas Suppliers,"Balkhu Chowk, P.O. Box: 10780, Ktm,","00977-1-4671386,9851126112,"
DURGA MODERN OIL MILL,"Kataiya, Butwal/Bhairahawa","520285521473,,"
Everest Gas Industry Pvt. Ltd.,"Chobhar, P.O. Box: 4790, Ktm,","00977-1-43307374333889,,"
GANDAKI OIL MILLS,"Mahendra Pool,","521571523016,,"
Gauri Shanker Gas Udyog (P) Ltd,"Indra Chowk, P.O. Box: 772, Ktm,","00977-1-42240744248732,,"
GOVIND OIL INDUSTRIES,"Kataiya, Butwal/Bhairahawa","520360521939,,"
Griha Laxmi Gas Co. Pvt. Ltd.,"P.O. Box: 170, Pkr,","524977,,"
GYAN INDUSTRIES PVT. LTD.,"Kathmandu,","44304064430454,,"
Himalayan Petrochemicals Ltd.,"Kantipath, P.O. Box: 11211, Ktm,","00977-1-4216305,,"
HIMAL OXYGEN PVT. LTD.,"Kantipath,","42254904226327,,"
Koshi Gas Udyog (P) Ltd.,"Gwarko, P.O. Box: 19416, Ktm,","00977-1-55362465548140,,"
KOSHI GAS UDYOG PVT. LTD.,"Tripureshwor,","4257212,,"
MANAKAMANA VEGETABLE GHEE OIL CO. PVT. LTD.,"Battisputali,","4477288,,"
Moti Shrestha & Sons,"GPO: 2060, Ktm, Kupondole,","5523376,,"
NANDAN GHEE AND OIL INDUSTRIES PVT. LTD.,"Kathmandu,","44122144420233,,"
NARAYAN VEGETABLE INDUSTRIES PVT. LTD.,"Bhanutole,","526929523330,,"
NAVA- JYOTI GASES PVT. LTD.,"Koteshwor,","4111919,,"
Nepal Biogas Promotion Association,"Lalitpur, P.O. Box: 10074, Ktm,","00977-1-55298885544562,,"
Nepal Cylinders Pvt. Ltd.,"Pulchowk,","00977-1-55514645520343,,"
NEPAL SAL SEED OIL PVT. LTD.,"Kantipath,","42486334244352,,"
NIDHI OIL MILL,"Kantipath,","42486334422947,,"
PASHUPATI KHADYA TEL,"Thapathali,","42299224229888,,"
PRASHANTA ENTERPRISES,"Main Road, Chitwan","520295,,"
Sagarmatha Gas Udyog (P) Ltd.,"Tripureshwor, P.O. Box: 692, Ktm,","00977-1-42651264265127,,"
SHAKTI GAS PVT. LTD.,"Khichapokhari,","523835530358,,"
SHRI MAHAKALI OIL MILL,"Adarshnagar,","522462,,"
SHREE RAM REFINE OIL PRODUCTS PVT. LTD.,"Thapathali,","426005642609104260810,,"
SHREE SHIV SHAKTI GHEE UDYOG PVT. LTD.,"Teku,","41000414100042-45,,"
Siddhartha Acetylene & Carbon Di-oxide (P) Ltd.,"Kuleshwor, P.O. Box: 10780, Ktm,","00977-1-42715554274077,,"
SIDDHARTHA ACETYLENE AND CARBON DI-OXIDE PVT. LTD.,"Kuleshwor,","42715554274077,,"
SIDDHATHA OIL INDUSTRIES,"Tripureshwor,","42552834255290,,"
SRI KRISHNA OIL REFINERY AND VEGETABLE GHEE INDUSTRIES PVT. LTD.,"Tahachal,","42734014273402,,"
Baba Gas Udyog (P) Ltd.,"Chitwan,","056-529374529377,,"
Koshi Gas Udyog (P) Ltd.,"Duhabi, P.O. Box: 31,","+977-1-540069,,"
Manoj Gas Udyog Pvt. Ltd.,"M7VH+2RP, Kalankisthan Marga,","+977 1-4279308,,"
Motherland Energy Group Pvt. Ltd.,"Gongabu, P.O. Box: 20506, Ktm,","00977-1-4382495,00977-9841271677,"
Prima Gas Udyog,Pakali,"unknown,,"
Ugratara trade Concern,"Amargadhi 5,","096420562,9848728807,"
All Nepal Biogas Company Pvt. Ltd.,unknown,"6636779851055209,,"
Himalayan Petro Chemicals P. Ltd.,"Teenkune, P.O. Box: 10175, Ktm,","00977-1-4216305,,"
HIMALAYAN PETRO CHEMICALS PVT. LTD.,"Kantipath,","4216305,,"
MANOKAMANA VEGETABLE GHEE AND OIL INDUSTRIES PVT. LTD.,"Battisputali,","44708914480407,,"
MOTI SHRESTHA AND SONS,Lalitpur,"5523376,,"
Siddhartha Acetylene & Carbon Di-oxide (P) Ltd.,"Kapilvastu, Kapilvastu","076-530032,,"
Trishuli Gas Pvt. Ltd.,"Bhairahawa, Bhairahawa","520725,,"
Rajdhani Gas Industries Pvt. Ltd.,"Exhibition Road,","+977-1-4227653,+977-984-9142455,"
Baba Gas Udyog (P) Ltd.,"Gwarko,","00977-1-5542270,,"
BABA GAS UDYOG PVT. LTD.,"Kathmandu,","4271734,,"
D.G. INTERNATIONAL,"New Baneshwor,","4490320,,"
GAURI SHANKAR GAS UDYOG PVT. LTD.,"Putalisadak,","42240744248732,,"
Gharelu Gobar Gas Tatha Prabidhi Bikash Co. Pvt. Ltd.,"Rupandehi, Bhairahawa","540827,,"
GORKHA GAS PVT. LTD.,"Kantipath,","4262798,,"
Laligurans Gobar Gas Co. Pvt. Ltd.,"Nawalparasi, Nawalparasi","078-580181,,"
Lekbeshi Saurya Urja Tatha Gobar Gas Sewa Co. Pvt. Ltd.,"Gulmi, Gulmi","079-520207,,"
L. P. Gas Udyog Sangh,"Man Bhawan,","5545597,,"
Lumbini Gas Co. (P) Ltd.,"New Road,","00977-1-4231232,,"
Manakamana Gobar Gas Sewa Kendra Pvt. Ltd.,"New Road,","535432,,"
Munal Gobar Gas Co. Pvt. Ltd.,unknown,"023-582170,,"
Nepal Gas Industries (Narayani) Pvt. Ltd.,"Simara, Bara","053-520150,,"
NEPAL UNITED CO. LTD.,"Ganabahal,","42494534250009,,"
NIRVANA VANASPATI UDYOG PVT. LTD.,"Thapathali,","42267224229099,,"
Pragati Gobar Gas Sewa Kendra Pvt. Ltd.,"Tanahun, Tanahu","065-560573560873,,"
SAGARMATHA FLOUR MILLS PVT. LTD.,"Sanihat,","525537,,"
Sana Krishak Samudaik Gobar Gas Co. Pvt. Ltd.,"Morang,","545359,,"
SANYAM VEGETABLE OIL IND. PVT. LTD.,"Kantipath,","42250094225099,,"
Sudurpaschimanchal Gobar Gas Tatha Urja Bikas Co. Pvt. Ltd.,unknown,"099-525096524064,,"
Sugam Gas Udhyog Pvt. Ltd.,"Ravi Bhawan,","+977-1-4287877,,"
Bheri Gas Traders,"Surkhet Road,","+977-1-522413,,"
Manoj Gas Udyog Pvt. Ltd.,"Shreepur,","+977-1-522479,,"
PASHUPATI KHADYA TEL UDYOG PVT. LTD.,"Saatghumti Chowk, GPO Box: 80,","+977-1-524248+977-1-521748,,"
Prima Gas Udyog (P.) Ltd.,"Pakali,","+977-1-583464,,"
Saibaba Gas Udyog (P) Ltd.,"Kalankisthan,","+977-1-4281841,,"
Shakti Gas (P) Ltd.,"New Road, GPO Box: 315,","+977-1-523835+977-1-530358+977-1-521758,,"
Shree Satya Narayan Gas Industries Pvt. Ltd.,"Balkumari,","00977-1-50061415006147,00977-9808901230,"
SWASTIK OIL INDUSTRIES PVT. LTD.,"Dillibazar,","44379914437993,,"
Trishul Gas Pvt. Ltd.,"Ghantaghar, GPO Box: 472,","+977-1-4226414+977-1-4244154+977-1-2001220,,"
AGRI IMPEX,"Tahachal,","42700824273401,,"
AMARSHAKTI ENTERPRISES,"Kamaladi,","4212078,,"
ARIHANT INDUSTRIES,"Surkhet,","520829,,"
ARUN BANASPATI UDYOG LTD.,"Sanihat,","525310525081,,"
ARYAL TEL UDYOG,"Prithibichowk, Chitwan","520770,,"
ASHOK GAS SERVICE,"Gyaneshwor,","4415939,,"
ASHOK TRADE INTERNATIOANAL,"Kathari,","527458,,"
Asian Gas Centre,"New Road,","00977-1-4238408,,"
BABA GAS SUPPLIERS,"Butwal/Bhairahawa,","543226545972,,"
Bagmati Gas Suppliers,"Narayanghat,","056-520307,,"
Bagmati Gas Suppliers,unknown,"520915,,"
Baikalpik Urja Bikash Company Pvt. Ltd.,"Chitwan,","056-525331,,"
BAJRANG RICE AND OIL MILL,"Station Road,","520089,,"
BAJARANG RICE AND OIL MILL,"Station Road,","520089,,"
Baneshori Gobar Gas Company Pvt. Ltd.,unknown,"9846023112,,"
Bhairabi Gobas Gas Udhyog Pvt. Ltd.,"Nuwakot, Nuwakot","010-69257,,"
BHAGAWATI OIL MILL,"Kalikanagar, Butwal/Bhairahawa","540063,,"
BHAGAWATI OILL MILL,"Kalikanagar, Butwal/Bhairahawa","540063,,"
Bhrikuti Gobas Gas Co. Pvt. Ltd.,"Kapilbastu, Bhairahawa","562238,,"
Bikram Gas Dipo,"Chapali,","00977-1-4375137,,"
BINDYABASHINI OIL,"Chitwan,","520483,,"
Biogas Construction & Energy Development Pvt. Ltd.,"Guleriya, Bardiya, Bardiya","084-420524,,"
BIO GAS CONTRUCTION AND ENERGY DEVELOPMENT PVT. LTD.,"Bardiya,","420524,,"
BISHAL GAS SERVICE CENTRE,"Sundhara,","4216252,,"
BISWA TRADE LINC,"Hetauda,","520915,,"
Butwal Gobar Gas,unknown,"541973545848,,"
BUTWAL GOBER GAS,"Butwal/Bhairahawa,","540713,,"
CHANDRA SHIVA RICE AND OIL MILLS PVT. LTD.,"Pokhariya,","522529522988,,"
CHABO SATHI DAL TEL UDYOG,"Adarshnagar,","522948,,"
CHIRANJIBI RICE OIL AND FLOUR MILL,"Narayangadh, Chitwan","520872,,"
Clean City Traders,"Jwagal,","00977-1-55521119841377930,,"
Cooking Gas Centre,"Lainchour,","00977-1-4427648,,"
COOKING GAS SERVICE,"Om Bahal,","4226155,,"
DAHAL GAS SUPPLIERS,"New Baneshwor,","47855609841436747,,"
DAKSHINKALI OIL MILL,"Main Road,","520589,,"
Deco Traders & Suppliers,"Rani Pauwa,","520878,,"
Deurali Gobas Gas Co. Pvt. Ltd.,unknown,"6647679851059311,,"
DHAULAGIRI CHEWRA AND OIL MILL,"Buttabari, Butwal/Bhairahawa","540772,,"
DHUNGANA RICE AND OIL MILLS,"Milanchowk,","522678,,"
DR. ADHIKARI S. K.,"Kathmandu,","4482294,,"
DR. CHAUDHARY S. R.,"Putalisadak,","44176224426959,,"
DR. DHAKAL GURU PRASAD,"Kamaladi,","4466178,,"
DR. ISHWOR NATH,"Kathmandu,","4221299,,"
DR. POKHAREL DINESH CHANDRA,"Baneshwor,","44714394474968,,"
DR. SHRESTHA PRADEEP,"Kathmandu,","4258559,,"
DR. YADAV PRADEEP KUMAR,"Kathmandu,","42278954467067,,"
DURGA RICE AND OIL MILLS,"Main Road,","522757,,"
Everest Bhandar,"Nagdhunga,","525115520976,,"
Everest Jyoti Gas (P) Ltd.,"New Baneshwor,","4781397,,"
EVEREST BYAPAR KENDRA,"Thutepipal, Butwal/Bhairahawa","522229522300,,"
EVEREST JYOTI GAS PVT. LTD.,"Jyatha,","42493554249276,,"
Gandaki Gobar Gas Sewa Kendra Pvt. Ltd.,"Prithvichowk,","523145,,"
GANESH DAL AND OIL MILL,"Maisthan,","522487,,"
GANESH DAHAL AND OIL MILL,"Maisthan,","522487,,"
GANESH OIL REFINERY PVT. LTD.,"Sanihat,","523967,,"
Gas Repairing Center,"Jawalakhel,","00977-1-9851001787,,"
Gas Service Center,"SAno Gaucharan,","00977-1-44329369851011145,,"
GAS LIGHT,"Putalisadak,","4417180,,"
GAS SEWA,"Soalteemode,","4278689,,"
Gaurishanker Gas Udhyog,"Sanga,","661490,,"
GAURI OIL MILL,"Gallamandi, Butwal/Bhairahawa","520592,,"
GAURI OILL MILLS,"Kataiya, Butwal/Bhairahawa","520591,,"
GAYATRI RICE AND OIL MILL,"Dharan Road,","522836,,"
GIYABI OIL UDYOG,"Adarshnagar,","522820,,"
G. M. Sayami Traders,"Bishal Nagar,","00977-1-44107764416241,,"
Gobar Gas & Krishi Yantra Bikash P. Ltd.,unknown,"520327,,"
Gobar Gas Co. P. Ltd.,"Biratnagar Road,","524764,,"
Gobar Gas Tatha Krishi Yantra Bikash,"Bhrikuti Chowk,","522968521764,,"
Gobar Gas Tatha Krishi Yantra Bikash Pvt. Ltd.,"Prithvichowk,","523145,,"
GOBAR GAS AND KRISHI YANTRA BIKASH PVT.LTD.,"Chitwan,","520327,,"
GOPAL RICE AND OIL MILL,"Gaheli,","522631,,"
Gorakhkali Gobar Gas Tatha Urja Bikash Co. Pvt. Ltd.,"Gorkha, Gorkha","064-4205529841319627,,"
Harmo Gobar Gas Co. Pvt. Ltd.,"Rautahat,","9841278899,,"
Hetauda Gobar Gas Co. Pvt. Ltd.,"Makwanpur,","522824985067246,,"
Himal Cooking Gas Service,"Maharajgunj,","00977-1-4375430,,"
Himal Gas,"New Road, P.O. Box: 11002, Ktm,","00977-1-42380254238024,,"
HIMALAYA OIL IND.,"Diyalo Road, Chitwan","520628,,"
Himal Gas,"Kavre (Fac.),","+977-1-661490+977-1-663185,,"
HIRA RICE AND OIL MILLS,"Tinpani,","522520,,"
JAI BALAJEE OIL INDUSTRIES PVT.LTD.,"Surkhet,","520593529577,,"
JAI SHREE RICE AND OIL MILLS PVT. LTD.,"Hattimuda,","522819,,"
JAL BINAYAK OIL AND SPICES MILL,"Na Tole, Lalitpur","5528572,,"
Janabhawana Gobar Gas Udhyog Pvt. Ltd.,"Nuwakot, Nuwakot","010-560123,,"
Janapriya Gobar Gas Co. Pvt. Ltd.,"Kapilvastu, Kapilvastu","076-560293,,"
JANAKI RICE AND OIL MILL,"Mills Area,","520058,,"
JAYSHRI ADHUNIK KHADYA TEL UDHYOG,"Jyshri House,","526972,,"
JAY BALAJI OIL INDUSTRIES PVT. LTD.,"Kathmandu,","4482845,,"
JUGAL RICE AND OIL MILL,"Hatkhola,","522043522605,,"
Kamadhenu Baikalpik Urja Co. Pvt. Ltd.,"Surunga, Jhapa, Jhapa","023-550046,,"
Kamala Gobar Gas Co. Pvt. Ltd.,"Birtamod, Jhapa","023-541094542461,,"
Kantipur Gas House,"Balaju,","00977-1-4362195,,"
Kantipur Gobar Gas Co. Pvt. Ltd.,"Sindhuli, Sindhuli","047-520405,,"
KANDEWAL RICE AND OIL FLOUR MILLS,"Reshamkothi,","522388,,"
KANDEWAL RICE AND FLOUR MILL,"Birgunj,","522388,,"
"KHANAL OIL, RICE AND FLOUR MILL","Narayangadh, Chitwan","520445,,"
KHEMI SATI RICE AND OIL MILL,"Adarshnagar,","522471,,"
KHEMI SATHI RICE AND OIL MILL,"Adarshnagar,","522471,,"
Kishan Gobar Gas Udhyog Pvt. Ltd.,"Nuwakot, Nuwakot","010-6604354360130 (Ktm),,"
KISHORI RICE AND OIL MILL,"Mills Area,","520084,,"
KISHORI OIL AND RICE MILL,"Mills Area,","520084,,"
KOSHI OIL AND TRADE CONCERN,"Kanchanbari,","522390,,"
Krishi Bikash Gobar Gas Co. Pvt. Ltd.,"Morang,","528799,,"
KRISHNA RICE AND OIL MILL,"Hatkhola,","522816,,"
Kumar Trade Links,"Main Road,","521979,,"
KUMARIPATI NEPAL GAS DEALER,"Kumaripati, Lalitpur","5527537,,"
KUMARI RICE AND OIL MILLS,"Jahada,","522063,,"
Lamjung Gobar Gas Nirman Tatha Gramin Batabaran Samrachhyan Pvt. Ltd.,"Lamjung,","061-5395509841206315,,"
LAXMI OIL AND FLOUR MILLS,"Main Bazar,","520532,,"
LAXMI ENTERPRISES,"Lumbini Road, Butwal/Bhairahawa","521898,,"
LAXMI RATNA THE BROTHER,"Narayangadh, Chitwan","521253,,"
LAXMI GHEE IND. PVT. LTD.,"Kalikasthan,","4413299,,"
LAXMI OIL AND FLOUR MILL,"Main Bazar,","520532,,"
Lokpriya Gobar Gas Tatha Shakti Bikash Pvt. Ltd.,unknown,"581876026-5200609841204030,,"
L.P.G. Gas Service,"Kamaladi,","00977-1-4437329,,"
L. P. GAS UDYOG ASSOCIATION,"Jawalakhel, Lalitpur","5545597,,"
Lumbini Gas Co. (P) Ltd.,"Maharajgunj, P.O. Box: 10595, Ktm,","00977-1-4372328,,"
Lumbini Gas Co. (P) Ltd.,unknown,"540850,,"
Lumbini Gas Co. (P) Ltd.,"Gaidakot, Bhairahawa","521720520103,,"
LUMBINI GAS CO. PVT. LTD.,"Maharajgunj,","4372328,,"
LUMBINI GAS COMPANY,"Nawalparasi, Chitwan","520103521720,,"
Machapuchhre Biogas Tatha Gramin Urja Bikash Co. Pvt. Ltd.,"Tanahun, Tanahu","9846021700,,"
MACHINERY OIL UDYOG,"Paklihawa, Butwal/Bhairahawa","520848,,"
Maheshmati Gobar Gas Udhyog Pvt. Ltd.,"Dhading, Dhading","010-529119,,"
Mahila Samuhik Bikash Co. Pvt. Ltd.,"Rautahat, Sarlahi","046-570058,,"
MAHA DURGA OIL MILL,"Reshamkothi,","521498,,"
MAHA SARASWATI RICE AND OIL MILL,"Gograha,","523955,,"
MAHADURGA OIL MILL,"Reshamkothi,","521498,,"
MAHALAXMI MAIDA AND OIL MILL PVT. LTD.,"Main Road,","522777,,"
MAHALXMI OIL MILL,"Murli,","521537,,"
Makalu Gobar Gas Co. Pvt. Ltd.,"Sankhuwasabha,","026-520513,,"
MARUTI GAS UDHYOG PVT. LTD.,"Sonapur,","540755,,"
Mechi Gobar Gas Co. Pvt. Ltd.,"Morang,","5450079842024372,,"
MEGDAS OIL INDUSTRIES,"Narayangadh, Chitwan","521401,,"
MEGH DAS OIL IND.,"Narayangadh, Chitwan","521401,,"
METRO GAS NEPAL,"Kilagal,","4221708,,"
MITTAL RICE AND OIL MILL,"Surkhet,","520475,,"
"MITHUKRISHNA RICE, OIL AND FLOUR MILL","Chitwan,","522629,,"
MORANG RICE AND OIL MILLS,"Main Road,","522720,,"
MUKTI OIL MILL,"Birgunj,","521049,,"
NARAYAN RICE OIL MILLS PVT. LTD.,"Sanihat,","522540,,"
Nepal Biogas Co. (P) Ltd.,"Ward 15,","523443,,"
Nepal Gas Dealer,"Ason,","00977-1-4231843,,"
Nepal Gas Dealer,"Bagbazar,","00977-1-4241442,,"
Nepal Gas Dealer,"Balaju,","00977-1-4350377,,"
Nepal Gas Dealer,"Bishal Nagar,","00977-1-44107764416241,,"
Nepal Gas Dealer,"Central Depo (Anamnagar),","00977-1-4770748,,"
Nepal Gas Dealer,"Chabahil,","00977-1-4499771,,"
Nepal Gas Dealer,"Dhobighat,","00977-1-5528257,,"
Nepal Gas Dealer,"Gwarko,","00977-1-5530360,,"
Nepal Gas Dealer,"Harihar Bhawan,","00977-1-5523069,,"
Nepal Gas Dealer,"Kalimati,","00977-1-4270182,,"
Nepal Gas Dealer,"Kumaripati,","00977-1-5538537,,"
Nepal Gas Dealer,"Lazimpat,","00977-1-4436604,,"
Nepal Gas Dealer,"Nayabazar,","00977-1-4362674,,"
Nepal Gas Dealer,"Pulchowk,","00977-1-5546443,,"
Nepal Gas Dealer,"Samakhusi,","00977-1-4352842,,"
Nepal Gas Dealer,"Sanepa,","00977-1-5520206,,"
Nepal Gas Dealer,"Satodbato,","00977-1-5529070,,"
Nepal Gas Dealer,"Thasikhel,","00977-1-5535501,,"
Nepal Gas Dealer,"Tripureshwor, P.O. Box: 8141, Ktm,","00977-1-4260995,,"
NEPAL VANASPATI GHEE UDHYOG,"Ind.State,","520660520369,,"
NEPAL BANASPATI GHEE UDYOG,"Sripur,","522969,,"
NEPAL OIL AND FLOUR MILL,"Rangeli,","522680,,"
Nepal Gas Butwal,Traffic Chowk Bhairawa,"+977-1-540620,,"
NEW CHITWAN OIL IND.,"Chitwan,","521791,,"
Nipurn Gobar Gas Company,"Lamjung, Gorkha","064-520754,,"
Nobel Gas Udhyog (P) Ltd.,"Satdobato, P.O. Box: 693, Ktm,","00977-1-55367625549179,,"
NOBEL GAS UDYOG PVT. LTD.,"Kamaladi,","42294814229518,,"
Nobel Gas Udhyog (P) Ltd.,"Naktajhija,","+977-1- 540218,,"
Palikhe Trade Centre,"Nag Dhunga,","525115520976,,"
Paschimanchal Dhaulagiri Gobar Gas Tatha Sewa Pvt. Ltd.,"Rupandehi, Bhairahawa","560691,,"
PASHUPATI GAS PVT. LTD.,"Tripureshwor,","4226058,,"
PASHUPATI NATH DAL TEL UDYOG,"Reshamkothi,","521593,,"
Pathibhara Gobar Gas Company Pvt. Ltd.,unknown,"027-5211079852680057,,"
Paudyal Gas Center,"Naxal,","00977-1-4436422,,"
PIYA TRADING CONCERN,"Main Road, Chitwan","520965520525,,"
"PIYA RICE, OIL AND FLOUR MILL","Narayangadh, Chitwan","520828,,"
POKHAREL BIO GAS PRODUCT INDUSTRIES,"Butwal/Bhairahawa,","542665,,"
Prima Gas Udyog (P.) Ltd.,"Kumaripati,","00977-1-5533525,,"
Prima Gas Udyog (P.) Ltd.,unknown,"00977-1-6612922,,"
Public Gobar Gas & Rural Development Co. Pvt. Ltd.,"Rupandehi, Bhairahawa","543122987021237,,"
Public Urja Bikash Co. Pvt. Ltd.,unknown,"581639,,"
PYARA RICE AND OIL MILL,"Dharan,","520475,,"
Raj Traders,"Rangeli Road,","521956,,"
RAJENDRA RICE AND OIL FLOUR MILL,"Mahabir Road,","520640,,"
RAJAN GAS DEPO,"Jhamshikhel, Lalitpur","5529408,,"
RANGELI RICE AND OIL MILLS,"Sanihat,","522505,,"
Rapti Gobar Gas Co. Pvt. Ltd.,"Makwanpur,","521825,,"
Rastriya Baikalpik Urja Prabardhan Tatha Bistar Co. Pvt. Ltd.,"Dhumbarahi,","00977-1-44811662071124,,"
Ratna Joti Gobar Gas Tatha Urja Bikash Co. Pvt. Ltd.,"Tanahun, Tanahu","065-580011,,"
RITA OIL UDYOG,"Narayangadh, Chitwan","521179,,"
Sagarmatha Gas Udyog (P) Ltd.,unknown,"662027661767,,"
SAGARAMATHA GAS INDUSTRIES PVT. LTD.,"Tripureshwor,","4265127,,"
Sagar Gas,unknown,"+977-1-662027,,"
Sahayogi Rental Service & Gas Supplier,"Ravi Bhawan,","00977-1-42728724271676,,"
SAHARA GAS UDYOG PVT. LTD.,"Hetauda,","522117,,"
Samakhushi Gas Dipo,"Samakhushi,","00977-1-43538432092087,,"
Sarbodaya Urja Tatha Gobargas Co. Pvt. Ltd.,"Lamjungj,","061-539167,,"
SAURAV OIL MILL,"Samshergunj,","520392,,"
SHARDA COOKING GAS SUPPLIE5R,"Devkota Sadak, Butwal/Bhairahawa","520327,,"
SHARMA OIL MILL,"Surkhet,","520809,,"
SHAUBHAGYA RICE AND OIL MILLS,"Goswara Road,","523830,,"
Shiva Shakti Gobar Gas Pvt. Ltd.,unknown,"027-540250,,"
SHIVA RICE FLOUR AND OIL MILL,"Rani Ghat,","521534,,"
SHIVASHAKTI GHEE UDYOG PVT. LTD.,"Birgunj,","521384,,"
SHREE DAKSHINKALI RICE OIL AND FLOUR MILL,"Reshamkothi,","522093,,"
SHREE KRISHNA TEL UDYOG,"Chitwan,","521253,,"
SHREE LAXMI RICE OIL AND FLOWER MILL,"Belchowk, Chitwan","520587,,"
SHREE KRISHNA OIL MILL,"Balkhu, Lalitpur","5533414,,"
SHREE MAHASHAKTI TRADING,"Kalimati,","4270809,,"
Sital Gobar Gas Co. Pvt. Ltd.,unknown,"545766,,"
SOYA MILL,"Balaju,","4350327,,"
Subhidha Gas Service,"Om Bahal,","00977-1-4245388,,"
SUBHAKAMANA RICE AND OIL MILL,"Narayangadh, Chitwan","521680,,"
SUMAN GAS CENTRE,"Chhetrapati,","4263741,,"
Suna Traders,"New Road,","520730,,"
SUNDAR RICE AND FLOUR OIL MILL,"Birgunj,","522729,,"
SUNDER RICE AND FLOUR OIL MILL,"Birgunj,","522729,,"
Surya Gas Industries Pvt. Ltd.,"Sitapaila,","00977-1-40348484034849,,"
SURYA OIL MILL,"Sahidchowk, Chitwan","520407,,"
SURESH RICE AND OIL MILLS,"Sanihat,","522261,,"
Suvidha Gas Services,"Om Bahal,","+977-1-4245388,,"
Taplejung Gobar Gas Co. Pvt. Ltd.,unknown,"024-460031,,"
TEXTILE AND DOMESTIC TRADING CONCERN,"Minbhawan,","42310306610422,,"
TODI OIL AND FLOUR MILL,"Main Road,","522221,,"
TODI RICE AND OIL MILL,"Main Road,","522756,,"
Tribeni Gobar Gas Co. Pvt. Ltd.,"Nawalparasi, Nawalparasi","078-540313,,"
Trishul Gas Pvt. Ltd.,"Rupandehi, Bhairahawa","+977-1-520725,,"
